<?xml version="1.0" encoding="UTF-8"?>
<!ELEMENT reactions (reaction)+>
<!ELEMENT reaction (pattern+, outreaction+, customclass?)>
<!ELEMENT pattern (#PCDATA)>
<!ELEMENT outreaction (#PCDATA)>
<!ELEMENT customclass (#PCDATA)>
